{
  "$schema": "https://json-schema.org/draft/2020-12/schema",
  "$id": "https://mmals.research/schemas/claim-manifest.schema.json",
  "title": "MMALS G2 Claim Manifest",
  "description": "Machine-readable evidence manifest mapping every load-bearing claim in a G2 document to its evidence status, supporting estimators, and release-gate dependencies. Designed for Phase P0 (provenance freeze) onward.",
  "type": "object",
  "required": ["manifest_version", "document", "claims", "gates", "phases"],
  "properties": {

    "manifest_version": { "type": "string", "description": "Semver of this manifest schema instance, independent of the paper version." },

    "document": {
      "type": "object",
      "required": ["title", "version", "commit_hash", "date"],
      "properties": {
        "title": { "type": "string" },
        "version": { "type": "string", "description": "e.g. v0.2-internal" },
        "commit_hash": { "type": "string", "description": "Git commit of the source repo at freeze time." },
        "date": { "type": "string", "format": "date" },
        "archive_status": { "enum": ["internal", "release-candidate", "external-published"] }
      }
    },

    "estimators": {
      "type": "array",
      "description": "Registry of named estimators referenced by claims (e.g. route-function alignment estimators).",
      "items": {
        "type": "object",
        "required": ["estimator_id", "name", "target_quantity", "qualification_status"],
        "properties": {
          "estimator_id": { "type": "string" },
          "name": { "type": "string" },
          "target_quantity": { "type": "string", "description": "What the estimator claims to measure, e.g. route-function alignment, retention delta." },
          "method": { "type": "string" },
          "reference_oracle": { "type": "string", "description": "Controlled-data oracle used to qualify this estimator, if any." },
          "calibration_split_id": { "type": ["string", "null"], "description": "Which data split calibrated this estimator. Must differ from qualification_split_id." },
          "qualification_split_id": { "type": ["string", "null"] },
          "qualification_status": { "enum": ["unqualified", "in-qualification", "qualified", "rejected"] },
          "declared_coverage": { "type": "number", "minimum": 0, "maximum": 1 },
          "empirical_coverage": { "type": "number", "minimum": 0, "maximum": 1 },
          "boundary_bias_note": { "type": "string" },
          "selected_for_elegance_only": { "type": "boolean", "description": "Must be false. Flag exists so reviewers can explicitly check it was considered and rejected as a selection criterion." },
          "notes": { "type": "string" }
        }
      }
    },

    "gates": {
      "type": "array",
      "description": "Registry of release gates R0-R9. Thresholds must be frozen before the phase that could be evaluated against them runs (see phases[].uses_gate).",
      "items": {
        "type": "object",
        "required": ["gate_id", "name", "criterion", "status", "threshold_frozen"],
        "properties": {
          "gate_id": { "type": "string", "pattern": "^R[0-9]+$" },
          "name": { "type": "string" },
          "criterion": { "type": "string" },
          "metric": { "type": "string", "description": "e.g. FARgate, GateRegret, empirical_coverage" },
          "threshold_value": { "type": ["number", "null"] },
          "threshold_frozen": { "type": "boolean", "description": "True only if the threshold was fixed before any qualification-split evidence was seen." },
          "threshold_frozen_date": { "type": "string", "format": "date" },
          "threshold_frozen_commit": { "type": "string" },
          "status": { "enum": ["pending", "partial", "passed", "failed"] },
          "evaluated_on_split_id": { "type": "string" },
          "consequence_if_failed": { "type": "string", "description": "Claim-level downgrade permitted on failure, per Section 16.4, e.g. 'soft advisory gate only, no hard-admissibility claim'." }
        }
      }
    },

    "phases": {
      "type": "array",
      "description": "Registry of P0-P9 execution phases.",
      "items": {
        "type": "object",
        "required": ["phase_id", "name", "status"],
        "properties": {
          "phase_id": { "type": "string", "pattern": "^P[0-9]+$" },
          "name": { "type": "string" },
          "status": { "enum": ["not-started", "in-progress", "complete", "blocked"] },
          "depends_on_phases": { "type": "array", "items": { "type": "string" } },
          "uses_gates": { "type": "array", "items": { "type": "string" }, "description": "Gate IDs this phase evaluates against or must not contaminate." },
          "produces_split_ids": { "type": "array", "items": { "type": "string" } },
          "consumes_split_ids": { "type": "array", "items": { "type": "string" } },
          "contamination_check": {
            "type": "string",
            "description": "Explicit statement that consumes_split_ids for this phase are disjoint from any split used in an earlier estimator-selection phase. Required for any phase feeding a gate in 'gates'."
          }
        }
      }
    },

    "claims": {
      "type": "array",
      "items": {
        "type": "object",
        "required": ["claim_id", "text", "location", "status"],
        "properties": {
          "claim_id": { "type": "string" },
          "text": { "type": "string", "description": "The claim in paraphrased/normalized form, not necessarily verbatim." },
          "location": {
            "type": "object",
            "properties": {
              "section": { "type": "string" },
              "equation": { "type": "string" }
            }
          },
          "status": {
            "enum": ["established", "g1-qualified", "g2-candidate", "deferred"],
            "description": "established = supported by prior qualified work (e.g. G1, cited literature). g1-qualified = passed the G1 evidence ladder. g2-candidate = hypothesis with a defined falsification test but no passing evidence yet. deferred = explicitly out of scope until a prerequisite gate/phase passes."
          },
          "depends_on_estimators": { "type": "array", "items": { "type": "string" } },
          "depends_on_gates": { "type": "array", "items": { "type": "string" } },
          "depends_on_phases": { "type": "array", "items": { "type": "string" } },
          "falsification_test": { "type": "string", "description": "Required for g2-candidate claims. What observation would falsify this claim." },
          "external_publication_eligible": { "type": "boolean", "description": "False by default for g2-candidate and deferred claims." },
          "reviewer": { "type": "string" },
          "last_updated": { "type": "string", "format": "date" }
        },
        "allOf": [
          {
            "if": { "properties": { "status": { "const": "g2-candidate" } } },
            "then": { "required": ["falsification_test"] }
          },
          {
            "if": { "properties": { "status": { "enum": ["g2-candidate", "deferred"] } } },
            "then": {
              "properties": { "external_publication_eligible": { "const": false } }
            }
          }
        ]
      }
    }
  }
}
